{
  "alignment_mode": "baseline_human_guided",
  "hypothesis_alignment": [
    {
      "hypothesis_id": "H-001",
      "value_alignment_score": 0.66
    },
    {
      "hypothesis_id": "H-002",
      "value_alignment_score": 0.66
    },
    {
      "hypothesis_id": "H-003",
      "value_alignment_score": 0.66
    },
    {
      "hypothesis_id": "H-004",
      "value_alignment_score": 0.66
    },
    {
      "hypothesis_id": "H-005",
      "value_alignment_score": 0.66
    }
  ],
  "mission_profile": [
    "analysis",
    "approve",
    "architecture",
    "assessment",
    "complete",
    "defines",
    "docs",
    "feasibility",
    "guided",
    "human",
    "invention",
    "invention_logs",
    "master_tech_spec",
    "medium",
    "operator",
    "platform",
    "research",
    "spec",
    "specifications",
    "task"
  ],
  "program_alignment": [
    {
      "program_id": "RP-947",
      "value_alignment_score": 0.65
    },
    {
      "program_id": "RP-191",
      "value_alignment_score": 0.65
    },
    {
      "program_id": "RP-104",
      "value_alignment_score": 0.65
    }
  ],
  "type": "VALUE_ALIGNMENT_REPORT"
}
